{
  "contractVersion": 1,
  "state": {
    "schemaVersion": 1,
    "demoDate": "2026-09-08",
    "classifications": [
      {
        "id": "I01",
        "name": "기계·소재",
        "parentId": "",
        "kind": "industry",
        "active": true,
        "visible": true
      },
      {
        "id": "I02",
        "name": "바이오·의료",
        "parentId": "",
        "kind": "industry",
        "active": true,
        "visible": true
      },
      {
        "id": "I03",
        "name": "정보통신",
        "parentId": "",
        "kind": "industry",
        "active": true,
        "visible": true
      },
      {
        "id": "T01",
        "name": "제조기술",
        "parentId": "",
        "kind": "technology",
        "active": true,
        "visible": true
      },
      {
        "id": "T02",
        "name": "스마트공정",
        "parentId": "T01",
        "kind": "technology",
        "active": true,
        "visible": true
      },
      {
        "id": "T03",
        "name": "소재분석",
        "parentId": "T01",
        "kind": "technology",
        "active": true,
        "visible": true
      },
      {
        "id": "T04",
        "name": "바이오 공정",
        "parentId": "",
        "kind": "technology",
        "active": true,
        "visible": true
      },
      {
        "id": "T05",
        "name": "인공지능",
        "parentId": "",
        "kind": "technology",
        "active": true,
        "visible": true
      },
      {
        "id": "C01",
        "name": "기술애로",
        "parentId": "",
        "kind": "consultation",
        "active": true,
        "visible": true
      },
      {
        "id": "C02",
        "name": "사업화",
        "parentId": "",
        "kind": "consultation",
        "active": true,
        "visible": true
      },
      {
        "id": "C03",
        "name": "품질·인증",
        "parentId": "",
        "kind": "consultation",
        "active": true,
        "visible": true
      },
      {
        "id": "O01",
        "name": "대학",
        "parentId": "",
        "kind": "institution",
        "active": true,
        "visible": true
      },
      {
        "id": "O02",
        "name": "연구기관",
        "parentId": "",
        "kind": "institution",
        "active": true,
        "visible": true
      },
      {
        "id": "O03",
        "name": "민간기업",
        "parentId": "",
        "kind": "institution",
        "active": true,
        "visible": true
      },
      {
        "id": "R01",
        "name": "충남",
        "parentId": "",
        "kind": "region",
        "active": true,
        "visible": true
      },
      {
        "id": "R02",
        "name": "대전",
        "parentId": "",
        "kind": "region",
        "active": true,
        "visible": true
      },
      {
        "id": "R03",
        "name": "충북",
        "parentId": "",
        "kind": "region",
        "active": true,
        "visible": true
      },
      {
        "id": "R04",
        "name": "세종",
        "parentId": "",
        "kind": "region",
        "active": true,
        "visible": true
      },
      {
        "id": "R05",
        "name": "경북",
        "parentId": "",
        "kind": "region",
        "active": true,
        "visible": true
      },
      {
        "id": "R06",
        "name": "부산",
        "parentId": "",
        "kind": "region",
        "active": true,
        "visible": true
      },
      {
        "id": "S01",
        "name": "산업 현장 경험",
        "parentId": "",
        "kind": "reason",
        "active": true,
        "visible": true
      },
      {
        "id": "S02",
        "name": "전문기술 보유",
        "parentId": "",
        "kind": "reason",
        "active": true,
        "visible": true
      },
      {
        "id": "W01",
        "name": "로그인",
        "parentId": "",
        "kind": "work",
        "active": true,
        "visible": true
      },
      {
        "id": "W02",
        "name": "사업신청",
        "parentId": "",
        "kind": "work",
        "active": true,
        "visible": true
      },
      {
        "id": "W03",
        "name": "사업관리",
        "parentId": "",
        "kind": "work",
        "active": true,
        "visible": true
      },
      {
        "id": "W04",
        "name": "기술닥터",
        "parentId": "",
        "kind": "work",
        "active": true,
        "visible": true
      }
    ],
    "doctors": [
      {
        "id": "D001",
        "userId": "SM001",
        "name": "김가람",
        "organization": "가상 충남산업대학교",
        "owner": "충남",
        "institution": "O01",
        "industry": "I01",
        "technologies": [
          "T02",
          "T03"
        ],
        "consultations": [
          "C01",
          "C03"
        ],
        "supportRegions": [
          "충남",
          "대전",
          "세종"
        ],
        "reasons": [
          "S01",
          "S02"
        ],
        "year": "2026",
        "available": true,
        "degree": "공학박사",
        "career": "산업 현장 기술지원 및 기업 공동연구 12년",
        "certificates": "품질경영기사 · 산업기술 공로상 (가상)",
        "acquiredTechnology": "공정 최적화·불량 원인 분석",
        "updatedAt": "2026-09-01T09:00:00+09:00",
        "history": []
      },
      {
        "id": "D002",
        "userId": "SM002",
        "name": "이서준",
        "organization": "가상 대전소재연구원",
        "owner": "대전",
        "institution": "O02",
        "industry": "I01",
        "technologies": [
          "T03"
        ],
        "consultations": [
          "C01",
          "C02"
        ],
        "supportRegions": [
          "대전",
          "충남"
        ],
        "reasons": [
          "S01",
          "S02"
        ],
        "year": "2026",
        "available": true,
        "degree": "공학박사",
        "career": "산업 현장 기술지원 및 기업 공동연구 12년",
        "certificates": "품질경영기사 · 산업기술 공로상 (가상)",
        "acquiredTechnology": "기업 맞춤형 기술 진단",
        "updatedAt": "2026-09-01T09:00:00+09:00",
        "history": []
      },
      {
        "id": "D003",
        "userId": "SM003",
        "name": "박지온",
        "organization": "가상 충북바이오센터",
        "owner": "충북",
        "institution": "O02",
        "industry": "I02",
        "technologies": [
          "T04"
        ],
        "consultations": [
          "C01",
          "C03"
        ],
        "supportRegions": [
          "충북",
          "충남"
        ],
        "reasons": [
          "S01",
          "S02"
        ],
        "year": "2026",
        "available": true,
        "degree": "공학박사",
        "career": "산업 현장 기술지원 및 기업 공동연구 12년",
        "certificates": "품질경영기사 · 산업기술 공로상 (가상)",
        "acquiredTechnology": "기업 맞춤형 기술 진단",
        "updatedAt": "2026-09-01T09:00:00+09:00",
        "history": []
      },
      {
        "id": "D004",
        "userId": "SM004",
        "name": "최도윤",
        "organization": "가상 세종AI연구소",
        "owner": "세종",
        "institution": "O02",
        "industry": "I03",
        "technologies": [
          "T05"
        ],
        "consultations": [
          "C01",
          "C02"
        ],
        "supportRegions": [
          "세종",
          "충남"
        ],
        "reasons": [
          "S01",
          "S02"
        ],
        "year": "2026",
        "available": true,
        "degree": "공학박사",
        "career": "산업 현장 기술지원 및 기업 공동연구 12년",
        "certificates": "품질경영기사 · 산업기술 공로상 (가상)",
        "acquiredTechnology": "공정 최적화·불량 원인 분석",
        "updatedAt": "2026-09-01T09:00:00+09:00",
        "history": []
      },
      {
        "id": "D005",
        "userId": "SM005",
        "name": "정하린",
        "organization": "가상 경북제조연구원",
        "owner": "경북",
        "institution": "O02",
        "industry": "I01",
        "technologies": [
          "T02"
        ],
        "consultations": [
          "C01",
          "C03"
        ],
        "supportRegions": [
          "경북",
          "충남"
        ],
        "reasons": [
          "S01",
          "S02"
        ],
        "year": "2025",
        "available": true,
        "degree": "공학박사",
        "career": "산업 현장 기술지원 및 기업 공동연구 12년",
        "certificates": "품질경영기사 · 산업기술 공로상 (가상)",
        "acquiredTechnology": "기업 맞춤형 기술 진단",
        "updatedAt": "2025-02-10T09:00:00+09:00",
        "history": []
      },
      {
        "id": "D006",
        "userId": "SM006",
        "name": "오유진",
        "organization": "가상 부산기술대학교",
        "owner": "부산",
        "institution": "O01",
        "industry": "I01",
        "technologies": [
          "T03"
        ],
        "consultations": [
          "C01",
          "C02"
        ],
        "supportRegions": [
          "부산",
          "충남"
        ],
        "reasons": [
          "S01",
          "S02"
        ],
        "year": "2025",
        "available": false,
        "degree": "공학박사",
        "career": "산업 현장 기술지원 및 기업 공동연구 12년",
        "certificates": "품질경영기사 · 산업기술 공로상 (가상)",
        "acquiredTechnology": "기업 맞춤형 기술 진단",
        "updatedAt": "2026-09-01T09:00:00+09:00",
        "history": []
      },
      {
        "id": "D007",
        "userId": "SM007",
        "name": "한시우",
        "organization": "가상 충남품질연구원",
        "owner": "충남",
        "institution": "O02",
        "industry": "I01",
        "technologies": [
          "T02"
        ],
        "consultations": [
          "C01",
          "C03"
        ],
        "supportRegions": [
          "충남",
          "대전",
          "세종"
        ],
        "reasons": [
          "S01",
          "S02"
        ],
        "year": "2025",
        "available": true,
        "degree": "공학박사",
        "career": "산업 현장 기술지원 및 기업 공동연구 12년",
        "certificates": "품질경영기사 · 산업기술 공로상 (가상)",
        "acquiredTechnology": "공정 최적화·불량 원인 분석",
        "updatedAt": "2025-02-10T09:00:00+09:00",
        "history": []
      },
      {
        "id": "D008",
        "userId": "SM008",
        "name": "강다온",
        "organization": "가상 대전테크랩",
        "owner": "대전",
        "institution": "O03",
        "industry": "I03",
        "technologies": [
          "T05"
        ],
        "consultations": [